Item,Verb,Sentence,Present_Agent,Present_Patient,Present_Items
1,DRINK,The grandma drinks juice.,there is a baby,there is some milk,a grandma and some juice.
2,EAT,The monkey eats the orange.,there is a duck,there is a banana,a monkey and an orange.
3,FEED,The girl feeds the dog.,there is a boy,there is a kitten,a girl and a dog.
4,READ,The boy reads the book.,there is a girl,there is a newspaper,a boy and a book.
5,ROLL,The baby rolls the ball.,there is a grandma,there is a tire,a baby and a ball.
6,WASH,The duck washes the bowl.,there is a monkey,there is a spoon,a duck and a bowl.
